{
  "defendantId": "50770ba9-37ea-4713-8cab-fe5bf1202716",
  "income": {
    "amount": 100.1,
    "frequency": "MONTHLY"
  },
  "benefits": {
    "claimed": true,
    "type": "free text describing benefits type",
    "deductPenaltyPreference": false
  },
  "employmentStatus": "EMPLOYED",
  "outgoings": [
    {
      "description": "Accommodation",
      "amount": 50
    },
    {
      "description": "Council Tax",
      "amount": 50
    }
  ]
}